"На півдні Білорусі нова зона обмеження польотів  Болото Ольманське, - ""Беларускі Гаюн"". ФОТО";Інтернет;Цензор.нет;Україна;Київ (Центральні);;ТОП-100;Новини та медіа;10.12.2024 13:43;10.12.2024 13:54;https://censor.net/ua/news/3524327/olmanski-bolota-zagroza-balistyky-z-bilorusi;" За інформацією моніторингової групи на півдні Білорусі з'явилася нова зона обмеження польотів, на додаток до наявної. Нова зона діятиме у період з 8 по 20 грудня 2024 року.   Про це повідомляє Цензор.НЕТ із посиланням на ""Беларускі Гаюн""   Зазначається, що нова зона обмеження запроваджена згідно з NOTAMN O0781/24 та O0782/24 у період з 8 по 20 грудня 2024 р. та забороняє польоти всіх ви";Леся Карпенко;;;;;;;
ОФІЦІЙНО У КП Дніпроводоканал зробили важливу заяву щодо оплати рахунків за спожиті послуги;Інтернет;nashemisto.dp.ua;Україна;Дніпропетровська область;Дніпро;Регіональний;Новини та медіа;28.05.2024 19:30;28.05.2024 19:44;https://nashemisto.dp.ua/2024/05/28/u-kp-dniprovodokanal-zrobyly-vazhlyvu-zaiavu-shchodo-oplaty-rakhunkiv-za-spozhyti-posluhy/; КП Дніпроводоканал нагадує дніпрянам про необхідність оплати поточних рахунків за спожиту воду, пише Наше місто з посиланням на телеграм-канал підприємства .    Ваша своєчасна оплата  це:     Безперебійне забезпечення міста водою: Кошти від оплати послуг водопостачання та водовідведення йдуть на підтримку роботи підприємства, ремонтні роботи та ліквідацію аварійних ситуацій.  Можли;Валерія Доброта;;;;;;;
Українці можуть завантажити додаток повітряна тривога - Перший Житомирський - Надзвичайні новини України за сьогодні;Інтернет;nlozhka.com.ua;Україна;Київ (Центральні);;Маловідомий;Спорт;24.06.2024 00:19;24.06.2024 00:15;https://nlozhka.com.ua/povitryana-tryvoha/zhytomyr/ukraintsi-mozhut-zavantazhyty-dodatok-povitriana-tryvoha-pershyy-zhytomyrskyy/; У дозвоні України говорять про застосунок, який дозволяє отримувати сповіщення про тривоги системи цивільної оборони. Цей застосунок, який вже доступний у Google Play Market та AppStore, не потребує реєстрації чи даних про геолокацію. Він надсилає максимально гучні критичні сповіщення про повітряну, хімічну, техногенну або інші види тривог, навіть у беззвучному або сплячому режимі смарт;Марія Іванова;;;;;;;
Повітряна тривога в Україні стане точнішою;Інтернет;sky.zp.ua;Україна;Запорізька область;Запоріжжя;Регіональний;Новини та медіа;15.11.2024 19:12;15.11.2024 19:19;https://sky.zp.ua/povitryana-trivoga-v-ukra%25D1%2597ni-stane-tochnishoyu/;   Впровадження ізраїльської системи раннього оповіщення в Україні наближається до завершення. Про це заявив український посол в Ізраїлі Євген Корнійчук. За його словами, частину обладнання вже активно використовують українські військові.     Як це працює?   Україна отримала від Ізраїлю сучасні тривимірні радари, здатні виявляти загрози з високою точністю. Ця техніка інтегрується з украї;;;;;;;;
Україною шириться повітряна тривога: ворог запустив БПЛА з північного напрямку;Інтернет;Obozrevatel;Україна;Київ (Центральні);;ТОП-100;Новини та медіа;16.10.2024 22:52;17.10.2024 00:23;https://war.obozrevatel.com/ukr/ukrainoyu-shiritsya-povitryana-trivoga-vorog-zapustiv-bpla-z-pivnichnogo-napryamku.htm; Російські війська ввечері у середу, 16 жовтня, знову запустили по Україні ударні дрони. Кілька БПЛА прямували на Київ, вони могли бути запущені з території Білорусі. Пізніше ще кілька груп безпілотників-камікадзе залетіли з північно-східного напрямку.  Відео дня  Про це повідомили у Telegram-каналі Повітряних сил Збройних сил України. Близько 20:00 військові закликали жителів Києва пере;Ольга Ліпич;;;;;;4127;
Зібрали корисні мобільні додатки для тернополян та переселенців - 20 хвилин - Надзвичайні новини України за сьогодні;Інтернет;nlozhka.com.ua;Україна;Київ (Центральні);;Маловідомий;Спорт;04.06.2024 00:07;04.06.2024 00:13;https://nlozhka.com.ua/povitryana-tryvoha/ternopil/zibraly-korysni-mobilni-dodatky-dlia-ternopolian-ta-pereselentsiv-20-khvylyn/; У цій статті ми зібрали найкорисніші мобільні додатки, які стануть у нагоді тернополянам та тим, хто переїхав до міста з інших регіонів. Ми розглянули додатки для цифрових документів, сповіщень про тривогу, громадського транспорту, таксі, комунальних послуг, дошок оголошень, замовлення та доставки товарів, аптек та багато інших. Кожен додаток поставлений в рейтингу, що допоможе вам зроб;Марія Іванова;;;;;;24;
"""Авдіївка - лише початок"": командир з Третьої штурмової озвучив попередження для українців";Інформаційне агентство;РБК-Україна;Україна;Київ (Центральні);;ТОП-100;Новини та медіа;29.02.2024 17:35;29.02.2024 17:45;https://www.rbc.ua/rus/styler/avdiyivka-lishe-pochatok-komandir-tretoyi-1709217973.html;" Микола з позивним ""Макар"" - командир штурмової групи в 3 ОШБр. Нещодавно він повернувся з Авдіївки і попередив українців про те, що це може бути лише початком.   Як повідомляє РБК-Україна (проект Styler), про це ""Макар"" розповів в інтерв'ю, яке вийшло на YouTube-каналі Ukrainian Witness.   Війна торкнеться всіх   ""Авдіївка - це, мабуть, лише початок. Потрібно готуватися. Ну як початок, ";Поліна Іваненко;;;;;;;
В Україні створили мобільний застосунок для постраждалих від домашнього насильства: як він працює;Інтернет;nikopolnews.net;Україна;Дніпропетровська область;Нікополь;Регіональний;Новини та медіа;25.03.2024 13:02;25.03.2024 13:02;https://nikopolnews.net/lite/avtotekhno/mariana-v-ukraini-stvoryly-mobilnyj-za/;     В Україні створили мобільний застосунок для постраждалих від домашнього насильства.   Про це повідомили на сайті Розірви коло.   Новий додаток допоможе українцям подолати домашнє насилля. Він був створений Міністерством внутрішніх справ України та Національною поліцією у партнерстві з UNFPA (фондом ООН у галузі народонаселення).    Уявіть, що є застосунок, який миттєво викликає п;Марина Щученко;;;;;;261;
"Очолював пресслужбу ОСУВ ""Хортиця"": у Повітряних силах сказали, хто замінить Ігната. Фото";Інтернет;Obozrevatel;Україна;Київ (Центральні);;ТОП-100;Новини та медіа;18.03.2024 18:00;18.03.2024 21:16;https://war.obozrevatel.com/ukr/ocholyuvav-pressluzhbu-osuv-hortitsya-u-povitryanih-silah-skazali-hto-zaminit-ignata-foto.htm;" Новим начальником служби зв'язків із громадськістю Командування Повітряних сил Збройних сил України  призначено Іллю Євлаша.  Раніше він очолював пресслужбу Оперативно-стратегічного угруповання військ ""Хортиця"".   Наказ про призначення Євлаша  був підписний 15 березня.  Про це повідомила пресслужба ПС ЗСУ.   ""Згідно з наказом Головнокомандувача Збройних Сил України  480 від 15 березня ";Олег Тимченко;;;;;;;
В Укрзалізниці відреагували на скандал у жіночому купе;Інтернет;nashemisto.dp.ua;Україна;Дніпропетровська область;Дніпро;Регіональний;Новини та медіа;06.08.2024 11:00;06.08.2024 11:28;https://nashemisto.dp.ua/2024/08/06/v-ukrzaliznytsi-vidreahuvaly-na-skandal-u-zhinochomu-kupe/; В інтернеті зявилося відео, де в жіночий вагон поїзда Запоріжжя  Ясіня у Дніпрі сів чоловік і мав намір подорожувати їхати. Пасажирки, обурені його присутністю, вимагали пояснень від провідниці щодо того, як чоловік може перебувати в жіночому вагоні, створеному спеціально для жінок. Натомість провідниця відповіла, що чоловікові продали квиток, і попросила показати, де написано, що чол;Валерія Федоренко;;;;;;902;
Посольство США попереджає про підвищений ризик атак рф напередодні Дня Незалежності України;Інтернет;visitukraine.today;Україна;Київ (Центральні);;Національний;Подорожі та туризм;22.08.2024 14:34;22.08.2024 14:34;https://visitukraine.today/uk/blog/4605/us-embassy-warns-of-increased-risk-of-russian-attacks-ahead-of-ukraines-independence-day; Посольство США опублікувало попередження для своїх громадян в Україні щодо підвищеного рівня загрози з боку рф. Дізнайтеся, як підготуватися та забезпечити свою безпеку у разі надзвичайної ситуації      Напередодні Дня незалежності України, який відзначається 24 серпня, Посольство США в Києві попередило своїх громадян про можливе збільшення кількості атак з боку рф на територію України.;;;;;;;;
За четвертий місяць війни в Житомирській області було майже 50 повітряних тривог;Інтернет;gnews.com.ua;Україна;Київ (Центральні);;Маловідомий;Консолідатори;03.07.2024 01:27;03.07.2024 01:46;https://gnews.com.ua/povitryana-trivoga-zaraz/zhitomir/za-chetvertyy-misiats-viyny-v-zhytomyrskiy-oblasti-bulo-mayzhe-50-povitrianykh-tryvoh/; За результатами чотирьох місяців вторгнення рф на територію України Житомирська область вже не входить до пятірки лідерів за кількістю сигналів тривоги. За інформацією онлайн-карти повітряних тривог, в пятірці найтривожніших областей (без врахування Луганської області) за кількістю сирен з 24 лютого по 24 червня знаходяться: Харківська, Донецька, Чернігівська, Запорізька області і;Микита Юдикін;;;;;;5;
За четвертий місяць війни в Житомирській області було майже 50 повітряних тривог;Інтернет;baza-sport.com.ua;Україна;Київ (Центральні);;Маловідомий;Консолідатори;08.07.2024 01:07;08.07.2024 01:55;https://baza-sport.com.ua/povitryana-trivoga-zaraz/zhitomir/za-chetvertyy-misiats-viyny-v-zhytomyrskiy-oblasti-bulo-mayzhe-50-povitrianykh-tryvoh/; За результатами чотирьох місяців вторгнення рф на територію України Житомирська область вже не входить до пятірки лідерів за кількістю сигналів тривоги. За інформацією онлайн-карти повітряних тривог, в пятірці найтривожніших областей (без врахування Луганської області) за кількістю сирен з 24 лютого по 24 червня знаходяться: Харківська, Донецька, Чернігівська, Запорізька області і;Станіслав Пархоменко;;;;;;29;
ОФІЦІЙНО Як у Дніпрі викликати міську аварійну службу;Інтернет;nashemisto.dp.ua;Україна;Дніпропетровська область;Дніпро;Регіональний;Новини та медіа;21.10.2024 12:00;21.10.2024 20:45;https://nashemisto.dp.ua/2024/10/21/iak-u-dnipri-vyklykaty-misku-avariinu-sluzhbu/; Аварійна служба Дніпра користується у містян великим попитом. Щодня до диспетчерської служби надходить понад сотня звернень з приводу аварійних ситуацій. Про це повідомляє Наше місто .   Ремонтні бригади займаються насамперед ліквідацією комунальних НП і не виконують робіт із благоустрою квартир та покращення комфорту проживання дніпрян.     Викликати аварійну службу можна лише за те;Разумний Олександр;;;;;;;
74-й Берлінський міжнародний кінофестиваль відзначився акціями протесту;Інтернет;womo.ua;Україна;Київ (Центральні);;Національний;Новини та медіа;19.02.2024 12:48;19.02.2024 12:48;https://womo.ua/74-y-berlinskiy-mizhnarodniy-kinofestival-vidznachivsya-aktsiyami-protestu/; Цьогоріч складі журі присутня українська письменниця Оксана Забужко   Кілька днів тому стартував Берлінале, один з найавторитетніших міжнародних кінофестивалів. Він став особливим для України, оскільки серед його учасників присутні українські фільми, а до складу журі увійшла письменниця Оксана Забужко.   Під час пресконференції членів журі на початку фестивалю в телефоні Оксани Забужко ;;;;;;;;
Гість Юрій Ігнат;ТБ;ICTV;Україна;Київ (Центральні);Київ;Національний;Новини та медіа;29.02.2024 09:12;29.02.2024 12:45;https://videostorage1.looqme.io/storage_tv/ICTV/2024-02-29/ICTV-2024-02-29T09:12:00+02:00-2024-02-29T09:22:00+02:00.mp4?prime=False;Далі будемо про здобутки українських військових. Вони знищили ще один російський винищувач. Бомбардувальник повітряної сили повідомили, що ворожий Су-34 збили на східному напрямку. Це вже третій приземлений російський літак за останні три дні і одинадцятий за лютий місяць. Зараз з нами Юрій Ігнат на прямому зв'язку з Церкви командування повітряних сил України. Наші вітання вам, пане Юрію;;;;;;;;
Знищення трьох літаків РФ і новий командувач Сил логістики ЗСУ: новини за 29 лютого;Інтернет;newsme.online;Україна;Київ (Центральні);;Маловідомий;Консолідатори;01.03.2024 06:36;01.03.2024 06:42;https://newsme.online/general/n/ocldou5cv-znishchennya-troh-litakiv-rf-i-noviy-komanduvach-sil-logistiki-zsu-novini-za-29-lyutogo; Учора, 29 лютого 2024 року, українські воїни знищили три ворожі літаки. А президент Володимир Зеленський змінив командувача Силами логістики ЗСУ.    Загарбники глушать зв'язок на окупованій території: під особливою увагою Енергодар.    Агітували голосувати за приєднання до РФ: СБУ затримала зрадниць з Херсонської області.    ГУР отримало списки людей, яких Росія хоче залучити до спецопе;;;;;;;;
В Українц повітряна тривога через пуски ракет з бортів стратегічної авіації;Інтернет;informator.ua;Україна;Київ (Центральні);;ТОП-100;Новини та медіа;31.03.2024 05:44;31.03.2024 05:50;https://informator.ua/uk/v-ukrajinc-povitryana-trivoga-cherez-puski-raket-z-bortiv-strategichnoji-aviaciji;Ракетні удари по Україні у березні 2024 року: ілюстративне фото  Ракетна атака в ніч на 31 березня 2024 року: моніторінгові паблики повідомили про те, щр ракети зайшли в повітряний простір України через Сумську область, прямують курсом у напрямку західних областей   Приблизно о 4 годині ранку 31 березня в Україні оголошено повітряну тривогу. Держава-агресор запустила ракети по території ;Информатор Украина;;;;;;2601;
Юрія Ігната звільнили з посади речника Повітряних сил ЗСУ: працюватиме на іншому напрямку;Інтернет;Obozrevatel;Україна;Київ (Центральні);;ТОП-100;Новини та медіа;16.03.2024 21:03;16.03.2024 21:38;https://war.obozrevatel.com/ukr/yuriya-ignata-zvilnili-z-posadi-rechnika-povitryanih-sil-zsu-pratsyuvatime-na-inshomu-napryamku.htm; Полковник  Юрій Ігнат  залишає посаду  начальника служби зв'язків із громадськістю Командування Повітряних сил Збройних сил України  . Він залишиться у ПС, але працюватиме на іншому напрямку.   Про звільнення спікера ввечері в суботу, 16 березня, заявив у Telegram командувач Повітряних сил  Микола Олещук  . Про причину він нічого не розповів.     Олещук зазначив, що з початку повномасшт;Дар'я Дурова;;;;;;4240;
Атаку шахедів відбила ППО на Хмельниччині;Інтернет;podillyanews.com;Україна;Хмельницька область;Хмельницький;Регіональний;Новини та медіа;15.03.2024 03:43;15.03.2024 03:43;https://podillyanews.com/2024/03/15/ataku-shahediv-vidbyto-na-hmelnychchyni/; Атаку шахедів відбила ППО на Хмельниччині        Через ніч після атаки ударних безпілотників на Хмельниччину історія повторилася. Ворожі БпЛА, запущені надвечір з півдня, протягом кількох годин знову летіли в напрямку нашої області. На шляху слідування по шахедах відпрацьовували сили ППО у сусідніх областях, проте охоронцям неба Хмельниччини також роботи вистачило. Про наслідки атак;;;;;;;;
Сум'яни не зважають на тривогу: як під час довготривалої повітряної тривоги працюють міські державні служби;Інтернет;suspilne.media;Україна;Київ (Центральні);;ТОП-100;Новини та медіа;07.08.2024 19:42;07.08.2024 19:47;https://suspilne.media/sumy/808549-sumani-ne-zvazaut-na-trivogu-ak-pid-cas-dovgotrivaloi-povitranoi-trivogi-pracuut-miski-derzavni-sluzbi/;  На Сумщині повітряна тривога тривала від учора і загрозу обстрілу з повітря зняли о 15 годині 13 хвилин. Загалом вона тривала добу та 4 години. Кореспонденти Суспільного з'ясували, як під час таких повітряних тривог у Сумах працює онкоцентр, центр надання адмінпослуг та Сервісний центр МВС.   Володимир на прийомі у лікаря. Суспільне Суми  Володимир  пацієнт обласного онкоцентру, прийш;;;;;;;781;
Як мешканцям прифронтових районів Запорізької області уберегтися від атак дронів РФ;Інтернет;zp.vgorode.ua;Україна;Запорізька область;Запоріжжя;Регіональний;Новини та медіа;04.12.2024 16:08;04.12.2024 16:08;https://zp.vgorode.ua/ukr/news/sobytyia/a1270468-jak-meshkantsjam-prifrontovikh-rajoniv-zaporizkoji-oblasti-uberehtisja-vid-atak-droniv-rf;  У прифронтових районах Запорізької області все частіше фіксують атаки ворожих дронів, які використовують для ураження цивільних авто та обєктів.    У Запорізькій ОВА розповіли, щоб мінімізувати ризик для життя, фахівці Центру стратегічних комунікацій та інформаційної безпеки розробили корисні рекомендації:    Зараз все найоперативніше у нашому Telegram-каналі . Підписуйтесь, щоб бути ;Александра Залозная;;;;;;;
