Заголовок;Тип ЗМІ;Джерело;Країна;Регіон;Місто;Рівень видання;Рубрика;Дата виходу;Дата обробки;URL;Анотація;Ім'я автора;Країна автора;Назва місця публікації;Кількість лайків;Кількість репостів;Кількість коментарів;Сумарна кількість переглядів разом із дублями;Тип повідомлення
"Видалити нафіг додаток ""Повітряна тривога"". Бо він вже не буде потрібен";Соціальні мережі;facebook;Україна;Київ (Центральні);;Національний;Информационно-новостные;19.01.2025 21:47;20.01.2025 22:16;https://www.facebook.com/SumyDeMozhlyvoVse/posts/pfbid02sDNBhyFobaXVFNG2wnggYyoP6STYiYv6xJXmXVy2axjwgqUtFJyMW8o29uwr56mVl?comment_id=3892472661023197;"Видалити нафіг додаток ""Повітряна тривога"". Бо він вже не буде потрібен";Vira Kuleba;;Суми де можливо все.;12;;0;;Коментар
У ДОДАТОК ПОВІТРЯНА ТРИВОГА ДОДАЛИ СПОВІЩЕННЯ ПРО НАБЛИЖЕННЯ РОСІЙСЬКИХ РАКЕТ. Додаток Повітряна тривога надсилатиме попередження про підвищену...;Соціальні мережі;twitter;Україна;Київ (Центральні);;;Информационно-новостные;28.02.2024 18:24;28.02.2024 18:53;https://twitter.com/mukhin_ua/status/1762876488926298454;"У ДОДАТОК ПОВІТРЯНА ТРИВОГА ДОДАЛИ СПОВІЩЕННЯ ПРО НАБЛИЖЕННЯ РОСІЙСЬКИХ РАКЕТ.
Додаток Повітряна тривога надсилатиме попередження про підвищену небезпеку в окремих містах та громадах.
Оновлення 6.0 вже доступне для користувачів iOS та Android.";Yurii Mukhin;;Yurii Mukhin;0;0;0;;Пост
"У мене взбунтувався додаток ""повітряна тривога"": на роботі верещить так, що аж три поверхи підскакує, а вдома серед ночі хіба один раз завібрує....";Соціальні мережі;facebook;Україна;Київ (Центральні);;Національний;Информационно-новостные;25.01.2025 09:03;25.01.2025 20:13;https://www.facebook.com/anna.aviva.71/posts/pfbid02mPFh9vSAQFuxnUBmNBY7kghtQz7t33W1ytWJZyHfieZ5dgmHCoHYMQb3pvNTNYv5l?comment_id=1050306803804616;"У мене взбунтувався додаток ""повітряна тривога"": на роботі верещить так, що аж три поверхи підскакує, а вдома серед ночі хіба один раз завібрує. Тож сплю і лише зранку дізнаюся про ситуацію.";Наталія Ґлазунова;Україна;Anna Aviva;0;;1;;Коментар
" Додаток ""Повітряна тривога"" оновили: що змінилося: Відтепер застосунок Повітряна тривога надсилатиме попередження про підвищену небезпеку в...";Соціальні мережі;telegram;;;;;;28.02.2024 19:43;28.02.2024 19:43;https://t.me/volynua/54135;" Додаток ""Повітряна тривога"" оновили: що змінилося:

Відтепер застосунок Повітряна тривога надсилатиме попередження про підвищену небезпеку в окремих містах та громадах. Про це йдеться в блозі Ajax Systems.Про це пише Українська правда, повідомляє ВолиньЮА.В оновленій версії 6.0 сповіщення про наближення ракети чи безпілотного літального апарата над...

#Війна, #Україна

VolynUA.com "; VolynUA  ;; VolynUA  ;;;;;Пост
Додаток повітряна тривога працює шикарно;Соціальні мережі;telegram;;;;;;13.02.2024 23:37;13.02.2024 23:37;https://t.me/poltava/894703;Додаток повітряна тривога працює шикарно;Pino Rhino;;ПОЛТАВА ;;;;;Пост
Додаток повітряна тривога;Соціальні мережі;telegram;;;;;;17.08.2024 06:13;17.08.2024 06:13;https://t.me/komentsylike/2276392;Додаток повітряна тривога;Марія Чеглакова;;SUMYLIKE TG комментарии;;;;;Відповідь
Повітряна тривога! Новий додаток сповіщень про небезпеку в Україні - t.me/operativniy_monitor!;Соціальні мережі;telegram;;;;;;14.12.2024 06:35;14.12.2024 06:49;https://t.me/truexakharkiv/53987;"Повітряна тривога!

Новий додаток сповіщень про небезпеку в Україні - t.me/operativniy_monitor!";ТрухаХарьков;;ТрухаХарьков;;;;;Пост
Повітряна тривога! Над областю висить дрон! Новий додаток сповіщень про небезпеку в Україні - t.me/operativniy_monitor!;Соціальні мережі;telegram;;;;;;13.12.2024 16:19;13.12.2024 16:22;https://t.me/-1001922269129/666284;"Повітряна тривога!

Над областю висить дрон!

Новий додаток сповіщень про небезпеку в Україні - t.me/operativniy_monitor!";$Кирил$;;ТрухаПолтава Chat;;;;;Пост
В МЕНЕ Є ДОДАТОК ПОВІТРЯНА ТРИВОГА.;Соціальні мережі;telegram;;;;;;23.04.2024 19:26;23.04.2024 19:26;https://t.me/svoikrcomment/949050;В МЕНЕ Є ДОДАТОК ПОВІТРЯНА ТРИВОГА.;Берьозкіна Наталія;;ЧАТ | СВОЇ;;;;;Відповідь
"В Україні оновили додаток ""Повітряна тривога"": Ігнат назвав відмінність Як повідомив речник Повітряних сил ЗСУ Юрій Ігнат, в Україні оновили...";Соціальні мережі;telegram;;;;;;29.02.2024 11:32;29.02.2024 11:32;https://t.me/Korupciya/196668;"В Україні оновили додаток ""Повітряна тривога"": Ігнат назвав відмінність

Як повідомив речник Повітряних сил ЗСУ Юрій Ігнат, в Україні оновили додаток ""Повітряна тривога"". Ця версія дозволяє отримати додаткову інформацію про загрозу.

Зокрема, додаток сповіщатиме, коли та чи інша ворожа ціль входитиме у повітряний простір України та небезпеку в тому регіоні, де перебуває користувач.  

";Корупція.Інфо;;Корупція.Інфо;;;;;Пост
Та краще додаток завантажити Повітряна тривога й підключити місто;Соціальні мережі;telegram;;;;;;29.04.2024 21:12;29.04.2024 21:12;https://t.me/poltava/940886;Та краще додаток завантажити Повітряна тривога й підключити місто;Anastasia ;;ПОЛТАВА ;;;;;Відповідь
"Підкажіть якийсь додаток ""повітряна тривога"", будь ласка";Соціальні мережі;telegram;;;;;;23.04.2024 17:30;23.04.2024 17:30;https://t.me/svoikrcomment/948885;"Підкажіть якийсь додаток ""повітряна тривога"", будь ласка";krutezna _kullka;;ЧАТ | СВОЇ;;;;;Відповідь
Повітряна тривога! Зявився іранський вилупок. Новий додаток сповіщень про небезпеку в Україні - t.me/operativniy_monitor!;Соціальні мережі;telegram;;;;;;13.12.2024 16:17;13.12.2024 16:38;https://t.me/truexapoltava/47552;"Повітряна тривога!

Зявився іранський вилупок. 

Новий додаток сповіщень про небезпеку в Україні - t.me/operativniy_monitor!";ТрухаПолтава;;ТрухаПолтава;;;;;Пост
"В Україні оновили додаток ""Повітряна тривога"": Ігнат назвав відмінність Як повідомив речник Повітряних сил ЗСУ Юрій Ігнат, в Україні оновили...";Соціальні мережі;telegram;;;;;;29.02.2024 10:20;29.02.2024 10:20;https://t.me/RBC_ua_news/85435;"В Україні оновили додаток ""Повітряна тривога"": Ігнат назвав відмінність

Як повідомив речник Повітряних сил ЗСУ Юрій Ігнат, в Україні оновили додаток ""Повітряна тривога"". Ця версія дозволяє отримати додаткову інформацію про загрозу.

Зокрема, додаток сповіщатиме, коли та чи інша ворожа ціль входитиме у повітряний простір України та небезпеку в тому регіоні, де перебуває користувач.  

";РБК-Україна;;РБК-Україна;;;;;Пост
"Доброго дня всім, обновіть додаток ""повітряна тривога"", там з'явилась опція ""підвищена небезпека"".";Соціальні мережі;telegram;;;;;;29.02.2024 17:11;29.02.2024 17:11;https://t.me/odhello_chat/6530957;"Доброго дня всім, обновіть додаток ""повітряна тривога"", там з'явилась опція ""підвищена небезпека"".";Sergey G.;;Подслушано Чат;;;;;Пост
В Україні оновили додаток Повітряна тривога Щоб користуватися новими можливостями застосунок потрібно оновити.;Соціальні мережі;telegram;;;;;;29.02.2024 10:46;29.02.2024 10:46;https://t.me/HromadskeRadioNews/31886;"В Україні оновили додаток Повітряна тривога

Щоб користуватися новими можливостями застосунок потрібно оновити.";Громадське радіо | Новини;;Громадське радіо | Новини;;;;;Пост
"Мобільний застосунок ""Повітряна тривога"" тепер буде повідомляти про підвищену небезпеку,  Ігнат ""Додаток сповіщатиме, коли ракети та...";Соціальні мережі;telegram;;;;;;29.02.2024 10:36;29.02.2024 10:36;https://t.me/TrueUA_info/20168;"Мобільний застосунок ""Повітряна тривога"" тепер буде повідомляти про підвищену небезпеку,  Ігнат

""Додаток сповіщатиме, коли ракети та безпілотники входитимуть у повітряний простір України та небезпеку в тому регіоні, де перебуває користувач"",  речник ПС. 

Разом з тим він порадив користуватися й іншими джерелами офіційної інформації, і не сприймати додаток ""Повітряна тривога"" як єд";TrueUA;;TrueUA;;;;;Пост
"Оновлений додаток ""Повітряна тривога"" тепер буде повідомляти про підвищену небезпеку,  Ігнат ""Додаток сповіщатиме, коли ракети та безпілотники...";Соціальні мережі;telegram;;;;;;29.02.2024 09:57;29.02.2024 09:57;https://t.me/UaOnlii/70788;"Оновлений додаток ""Повітряна тривога"" тепер буде повідомляти про підвищену небезпеку,  Ігнат

""Додаток сповіщатиме, коли ракети та безпілотники входитимуть у повітряний простір України та небезпеку в тому регіоні, де перебуває користувач"",  речник ПС. 

Україна Online | Підписатись";Україна Online: Новини | Політика;;Україна Online: Новини | Політика;;;;;Пост
"Оновлений додаток ""Повітряна тривога"" тепер буде повідомляти про підвищену небезпеку,  Ігнат ""Додаток сповіщатиме, коли ракети та безпілотники...";Соціальні мережі;telegram;;;;;;29.02.2024 09:57;29.02.2024 09:57;https://t.me/Ukraina_onli/3980527;"Оновлений додаток ""Повітряна тривога"" тепер буде повідомляти про підвищену небезпеку,  Ігнат

""Додаток сповіщатиме, коли ракети та безпілотники входитимуть у повітряний простір України та небезпеку в тому регіоні, де перебуває користувач"",  речник ПС. 

Україна Online | Підписатись";Україна Online Чат ;;Україна Online Чат ;;;;;Пост
"Оновлений додаток ""Повітряна тривога"" тепер буде повідомляти про підвищену небезпеку, - речник ПС ЗСУ Додаток сповіщатиме, коли ракети та...";Соціальні мережі;telegram;;;;;;29.02.2024 10:20;29.02.2024 10:20;https://t.me/operativnoZSU/138535;"Оновлений додаток ""Повітряна тривога"" тепер буде повідомляти про підвищену небезпеку, - речник ПС ЗСУ 

Додаток сповіщатиме, коли ракети та безпілотники входитимуть у повітряний простір України та небезпеку в тому регіоні, де перебуває користувач, - заявив Юрій Ігнат

https://t.me/operativnoZSU";Оперативний ЗСУ;;Оперативний ЗСУ;;;;;Пост
" Оновлений додаток ""Повітряна тривога"" тепер буде повідомляти про підвищену небезпеку, - Ігнат Додаток сповіщатиме, коли ракети та безпілотники...";Соціальні мережі;telegram;;;;;;29.02.2024 09:36;29.02.2024 09:36;https://t.me/weukrainetv/55972;" Оновлений додаток ""Повітряна тривога"" тепер буде повідомляти про підвищену небезпеку, - Ігнат

Додаток сповіщатиме, коли ракети та безпілотники входитимуть у повітряний простір України та небезпеку в тому регіоні, де перебуває користувач, повідомив речник Повітряних сил ЗСУ. 

Джерело: телеканал ""Ми-Україна""

@weukrainetv";Ми Україна | Новини сьогодні;;Ми Україна | Новини сьогодні;;;;;Пост
"Оновлений додаток ""Повітряна тривога"" тепер буде повідомляти про підвищену небезпеку,  Ігнат ""Додаток сповіщатиме, коли ракети та безпілотники...";Соціальні мережі;telegram;;;;;;29.02.2024 09:58;29.02.2024 09:58;https://t.me/VICTORIA_UA1/236274;"Оновлений додаток ""Повітряна тривога"" тепер буде повідомляти про підвищену небезпеку,  Ігнат

""Додаток сповіщатиме, коли ракети та безпілотники входитимуть у повітряний простір України та небезпеку в тому регіоні, де перебуває користувач"",  речник ПС. 

Агент України
 #Украина #Киев #Харьков #Львов #Одесса #Днепр #война";.;;.;;;;;Пост
Мобільний додаток Повітряна тривога отримав оновлення: які нові функції додали в застосунок https://inf.im/6ZKV9;Соціальні мережі;telegram;;;;;;29.02.2024 19:45;29.02.2024 19:45;https://t.me/dp_informator_ua/79572;"Мобільний додаток Повітряна тривога отримав оновлення: які нові функції додали в застосунок
https://inf.im/6ZKV9";Інформатор Дніпро;;Інформатор Дніпро;;;;;Пост
Може оновіть додаток, програма Повітряна тривога;Соціальні мережі;telegram;;;;;;22.05.2024 09:52;22.05.2024 09:52;https://t.me/people_advise_Lviv_varta1/339034;Може оновіть додаток, програма Повітряна тривога;Oksana Halan;;Люди радять - people advise ( Lviv varta1 );;;;;Відповідь
"#Додаток ""#Повітряна #тривога""";Соціальні мережі;facebook;Україна;Київ (Центральні);;Національний;Информационно-новостные;06.02.2024 21:56;07.02.2024 01:51;https://www.facebook.com/zhytomyr.online/posts/pfbid0DkmFi8eM8rP8aEAcChuqu4TimtWYHkKDyaptxfSdgooM5aJUhaYShC2EB4eWScbkl;"#Додаток ""#Повітряна #тривога""";Житомир-Онлайн;Україна;Житомир-Онлайн;2;0;0;;Пост
Застосунок Повітряна тривога надсилатиме сповіщення про наближення ракети або БПЛА під час загальної тривоги Для цього потрібно оновити додаток...;Соціальні мережі;telegram;;;;;;29.02.2024 11:29;29.02.2024 11:29;https://t.me/bitua/27765;"Застосунок Повітряна тривога надсилатиме сповіщення про наближення ракети або БПЛА під час загальної тривоги

Для цього потрібно оновити додаток та ввести свій регіон.";bit.ua;;bit.ua;;;;;Пост
"Оновлений додаток ""Повітряна тривога"" тепер буде повідомляти про підвищену небезпеку, - речник ПС ЗСУ Додаток сповіщатиме, коли ракети та...";Соціальні мережі;telegram;;;;;;29.02.2024 11:10;29.02.2024 11:10;https://t.me/vchasnoua/77025;"Оновлений додаток ""Повітряна тривога"" тепер буде повідомляти про підвищену небезпеку, - речник ПС ЗСУ 

Додаток сповіщатиме, коли ракети та безпілотники входитимуть у повітряний простір України та небезпеку в тому регіоні, де перебуває користувач, - заявив Юрій Ігнат

Підписатись | Сайт | Facebook | Надіслати новину";Вчасно | Новини Війни ;;Вчасно | Новини Війни ;;;;;Пост
Звичайна наша повітряна тривога. Зайдіть на Плей маркет і оновіть додаток, якщо він у вас автоматично ще не оновився.;Соціальні мережі;telegram;;;;;;01.03.2024 09:34;01.03.2024 09:34;https://t.me/svoikrcomment/855097;Звичайна наша повітряна тривога. Зайдіть на Плей маркет і оновіть додаток, якщо він у вас автоматично ще не оновився.;Kateryna;;ЧАТ | СВОЇ;;;;;Відповідь
Коли посеред ночі на маминому телефоні на повну гучність врубається додаток повітряна тривога:;Соціальні мережі;telegram;;;;;;11.05.2024 19:52;11.05.2024 19:52;https://t.me/anarchymemes/735638;Коли посеред ночі на маминому телефоні на повну гучність врубається додаток повітряна тривога:;Giancarlo Carbonell;;анархо-плітки ;;;;;Відповідь
Я тут зареєструвався після 24 тільки заради того що не працював в мене додаток повітряна тривога яке створило мінцифри;Соціальні мережі;telegram;;;;;;29.04.2024 02:42;29.04.2024 02:42;https://t.me/Ukraina_onli/4440040;Я тут зареєструвався після 24 тільки заради того що не працював в мене додаток повітряна тривога яке створило мінцифри;Ukraine ;;Україна Online Чат ;;;;;Відповідь
Додаток - Повітряна тривога;Соціальні мережі;tiktok.com;Україна;Київ (Центральні);;Національний;Новости и меди;07.07.2024 19:55;08.07.2024 04:04;https://www.tiktok.com/%40i.sophist/video/7388923098952781062;Додаток - Повітряна тривога;Владислав;Україна;Ягодзінський Сергій;0;0;0;;Коментар
Цейво, а вони вже встановили собі додаток, що волає коли повітряна тривога? Тре їм якось сказати ;Соціальні мережі;telegram;;;;;;23.08.2024 18:27;23.08.2024 18:29;https://t.me/Ukraina_onli/5068815;Цейво, а вони вже встановили собі додаток, що волає коли повітряна тривога? Тре їм якось сказати ;Сергій;;Україна Online Чат ;;;;;Відповідь
"@thenaukaua Тобто навіть в мух є додаток ""повітряна тривога""?";Соціальні мережі;twitter;Україна;Київ (Центральні);;;Информационно-новостные;29.08.2024 20:53;31.08.2024 00:27;https://x.com/kyiv0fficial/status/1829215758897033329;"@thenaukaua Тобто навіть в мух є додаток ""повітряна тривога""?";Kyiv Symmetric;Україна;nauka.ua;3;0;0;;Коментар
Підвищена небезпека оголошена в Хмельницькій громаді - офіційний додаток Повітряна тривога;Соціальні мережі;telegram;;;;;;26.08.2024 07:59;26.08.2024 08:39;https://t.me/yeuanews/23319;Підвищена небезпека оголошена в Хмельницькій громаді - офіційний додаток Повітряна тривога;Є Новини Хмельницького та області;;Є Новини Хмельницького та області;10;;0;;Пост
До уваги мешканців громади! Звертаємо увагу на те, що відсьогодні слідувати за оповіщенням Повітряна тривога можна буде через офіційний додаток...;Соціальні мережі;facebook;Україна;Київ (Центральні);;Національний;Информационно-новостные;04.12.2024 20:35;04.12.2024 21:33;https://www.facebook.com/rivnecouncil/posts/pfbid02NoMoeNHYHe3mBGw9uTPpQ4cRNZNvbM1Wn4GDHFVwav6oVwmcqintGurCmpn43yWjl;"До уваги мешканців громади!

Звертаємо увагу на те, що відсьогодні слідувати за оповіщенням Повітряна тривога можна буде через офіційний додаток ""Тривога"", а також у телеграм каналі секретаря Рівненської міської ради Віктора Шакирзяна
";Рівненська міська рада;Україна;Рівненська міська рада;3;0;0;;Пост
